{
  "allowed_read_roots": [
    "raw",
    "state",
    "vault"
  ],
  "allowed_write_roots": [
    "staging",
    "runs"
  ],
  "command": "compile",
  "expected_output": "runs/20260410T035102Z-compile-63df86ea/artifacts/codex-result.json",
  "host": "codex",
  "inputs": [
    "raw/openai-harness-engineering.md"
  ],
  "run_id": "20260410T035102Z-compile-63df86ea",
  "schema_version": 1
}
